{
	"$schema": "https://json-schema.org/draft/2019-09/schema",
	"properties": {
        "$schema": {
            "type": "string"
		},		
        "name": {
			"type": "string",
			"minLength": 1,
  			"maxLength": 20
        },
        "description": {
            "type": "string"
		},
		"foundation": {
			"type": "string"
		},
		"columns":{
			"$ref": "#/definitions/columns"
		}		
	},
	"additionalProperties": false,
    "definitions": {
        "columns":{
			"type": "object",
			"additionalProperties": 
			{ 
				"$ref": "#/definitions/column"
			}
		},
		"column":{
			"type": "object",
			"required": ["type","description"],
			"properties": {
				"type":{
					"type": "string",
					"enum": ["dimension", "measure"]
				},
				"description":"string",
				"aggression": {
					"type": "string",
					"enum": ["sum", "max", "min", "avg"]
				}
			},
			"additionalProperties": false
		}					
    }	
}